{"key":"child","title":"الصحة النفسية للطفل","subtitle":"محتوى يراعي العمر والنمو ويجمع بين الملاحظة والدعم والوقاية وطلب المساعدة.","illustration":"child.svg","accent":"sky","sources":[{"name":"WHO — Mental health of children and young people","url":"https://www.who.int/publications/i/item/9789240100374"},{"name":"UNICEF Parenting — Mental health explained","url":"https://www.unicef.org/parenting/mental-health/explained"}],"articles":[{"slug":"emotion-coaching","title":"تدريب الطفل على فهم مشاعره","summary":"مساعدة الطفل على تسمية المشاعر وتنظيمها بدل الخوف منها أو إنكارها.","signals":["يقول لا أعرف عند سؤاله عن شعوره","يتحول الانزعاج سريعًا إلى صراخ أو ضرب","يشكو جسديًا عند الضغط"],"steps":["سمِّ الشعور بلغة بسيطة","اربط الشعور بإشارة جسدية","درّب على تنفس أو حركة قصيرة","ناقش الحل بعد الهدوء"],"phrases":["يبدو أنك محبط لأن الخطة تغيرت","كل المشاعر مسموحة، لكن ليس كل السلوك"],"avoid":"مطالبة الطفل بالشرح وهو في ذروة الانفعال."},{"slug":"tantrums","title":"نوبات الغضب عند الأطفال","summary":"فهم نوبة الغضب كفقد مؤقت للتنظيم مع الحفاظ على حدود السلامة.","signals":["صراخ أو رمي أشياء عند المنع","تزداد النوبات مع الجوع أو التعب","يصعب عليه العودة للهدوء"],"steps":["أمّن المكان وقلل الكلام","حافظ على جملة حد واحدة","ساعده على الهدوء جسديًا دون إجبار","راجع المحفز والمهارة لاحقًا"],"phrases":["أنا هنا وسأحافظ على سلامتك","لن أسمح بالضرب، ويمكنك أن تغضب"],"avoid":"الجدال الطويل أو التصوير أو السخرية أثناء النوبة."},{"slug":"separation-anxiety","title":"قلق الانفصال لدى الطفل","summary":"دعم الانتقال من القرب إلى الاستقلال التدريجي دون اختفاء مفاجئ أو وعود غير واقعية.","signals":["تعلق شديد عند الوداع","آلام بطن قبل المدرسة","الخوف من أن يصيب الوالد مكروه"],"steps":["اجعل الوداع قصيرًا ومتوقعًا","استخدم جدولًا بصريًا للعودة","ابدأ بفترات انفصال صغيرة","نسق مع المدرسة"],"phrases":["سأعود بعد النشاط الأخير","من الطبيعي أن تشتاق وسنلتقي في الوقت المتفق"],"avoid":"الاختفاء سرًا لتجنب البكاء."},{"slug":"school-anxiety","title":"القلق المدرسي ورفض الذهاب","summary":"تمييز الخوف العابر عن نمط يعطل الحضور والتعلم والعلاقات.","signals":["تدهور صباحي متكرر","أعراض جسدية في أيام المدرسة فقط","غياب أو تأخر متزايد"],"steps":["استكشف التنمر وصعوبات التعلم","حافظ على تواصل هادئ مع المدرسة","ضع خطة عودة تدريجية","اطلب تقييمًا عند الاستمرار"],"phrases":["سنفهم ما الذي يجعل المدرسة صعبة","لن نلومك، وسنساعدك على العودة بأمان"],"avoid":"تحويل كل غياب إلى عقوبة دون معرفة السبب."},{"slug":"bullying","title":"التعامل مع التنمر","summary":"حماية الطفل وتوثيق السلوك وبناء خطة مع المدرسة دون تحميله مسؤولية إيقاف المعتدي وحده.","signals":["فقدان مقتنيات","تجنب أماكن أو حافلة معينة","تغير النوم أو المزاج بعد المدرسة"],"steps":["استمع وصدّق دون استجواب","وثق الوقائع والتواريخ","اطلب خطة حماية مكتوبة","درب الطفل على طلب المساعدة والابتعاد"],"phrases":["ما حدث ليس خطأك","شكراً لأنك أخبرتني، وسنتصرف معًا"],"avoid":"مواجهة الطفل الآخر مباشرة بطريقة قد تزيد الخطر."},{"slug":"child-sleep","title":"نوم الطفل والصحة النفسية","summary":"بناء روتين يربط النوم بالأمان والانتظام لا بالصراع.","signals":["مقاومة طويلة للنوم","استيقاظات متكررة","تعب وتهيج نهاري"],"steps":["ثبت وقت الاستيقاظ","اجعل الروتين قصيرًا ومتكررًا","أوقف الشاشات قبل النوم","استشر طبيبًا عند الشخير أو توقف التنفس"],"phrases":["جسمك يتعلم وقت الراحة","سنكرر نفس الخطوات كل ليلة"],"avoid":"التهديد أو ترك الطفل مع خوف شديد دون طمأنة مناسبة."},{"slug":"screens-child","title":"الشاشات وتنظيمها لدى الأطفال","summary":"موازنة الفائدة والترفيه مع النوم والحركة والعلاقات.","signals":["صعوبة التوقف","غضب شديد عند انتهاء الوقت","تراجع اللعب أو النوم"],"steps":["حدد موعد بداية ونهاية واضحًا","استخدم مؤقتًا مرئيًا","وفر بديلًا جذابًا","شاهد بعض المحتوى مع الطفل"],"phrases":["بقيت عشر دقائق ثم ننتقل للنشاط التالي","لن نستخدم الشاشة لإيقاف كل شعور صعب"],"avoid":"قواعد متقلبة تعتمد على مزاج الكبار."},{"slug":"attention-support","title":"دعم الانتباه والوظائف التنفيذية","summary":"تهيئة البيئة وتقسيم المهام قبل تفسير كل تشتت ككسل.","signals":["نسيان التعليمات المتعددة","البدء في مهام كثيرة دون إنهاء","تفاوت كبير بين الاهتمام بالأنشطة"],"steps":["أعط تعليمات خطوة واحدة","استخدم قائمة مرئية","قسّم المهمة إلى فترات قصيرة","اسمح بحركة منظمة"],"phrases":["لنبدأ بأول خطوة فقط","سأساعدك على تنظيم المهمة لا أن أفعلها بدلًا عنك"],"avoid":"التوبيخ المتكرر أمام الآخرين."},{"slug":"friendships","title":"صداقات الطفل ومهاراته الاجتماعية","summary":"تعليم المبادرة والحدود وإصلاح الخلاف بدل إدارة كل علاقة نيابة عنه.","signals":["عزلة مستمرة","خلافات متكررة لنفس السبب","الخوف الشديد من الرفض"],"steps":["تدربوا على بدء الحديث","مثلوا مواقف طلب الانضمام","علم قول لا باحترام","تواصلوا مع المدرسة عند الإقصاء المزمن"],"phrases":["يمكنك أن تسأل: هل أستطيع اللعب معكم؟","الصديق الجيد يحترم حدودك"],"avoid":"إجبار الطفل على مصادقة من يؤذيه."},{"slug":"child-grief","title":"الحزن والفقد عند الطفل","summary":"شرح الفقد بصدق مناسب للعمر وملاحظة أن الحزن قد يظهر في اللعب والسلوك.","signals":["أسئلة متكررة عن العودة","تراجع في مهارات مكتسبة","لعب يعيد مشهد الفقد"],"steps":["استخدم كلمات واضحة غير مبهمة","اسمح بتكرار الأسئلة","حافظ على الروتين","أخبر المدرسة بما حدث"],"phrases":["الشخص مات ولن يعود، ونحن سنبقى نعتني بك","يمكنك أن تحزن وأن تلعب في اليوم نفسه"],"avoid":"استخدام عبارات مثل نام للأبد التي قد أراد العتودة إلى عند لأسباب طبي أو المخاوف."},{"slug":"child-trauma","title":"مساندة الطفل بعد تجربة صادمة","summary":"استعادة الإحساس بالأمان والروتين وطلب دعم متخصص عند الأعراض المستمرة.","signals":["كوابيس أو لعب تكراري","فزع زائد","تجنب أشخاص أو أماكن"],"steps":["أعد الأمان المادي أولًا","قدم معلومات محدودة وواضحة","لا تضغط على سرد التفاصيل","اطلب علاجًا متخصصًا عند التعطل"],"phrases":["أنت الآن في أمان","لن أجبرك على الحديث، وسأكون هنا عندما تريد"],"avoid":"استجواب الطفل مرارًا من عدة بالغين."},{"slug":"abuse-warning-signs","title":"علامات تستدعي الانتباه لإساءة معاملة الطفل","summary":"التعامل مع الإشارات بجدية وبطريقة تحمي الطفل ولا تفسد التقييم المهني.","signals":["خوف غير معتاد من شخص محدد","إصابات متكررة بتفسيرات غير متسقة","معرفة أو سلوك جنسي غير مناسب للعمر"],"steps":["استمع دون أسئلة موجهة","أخبر الطفل أنه ليس مذنبًا","احمِه من الخطر الفوري","تواصل مع الجهات المختصة وفق بلدك"],"phrases":["أنا أصدق أنك تشعر بالخوف","ما حدث ليس خطأك"],"avoid":"وعد الطفل بسرية مطلقة عندما تكون السلامة مهددة."},{"slug":"autism-support","title":"دعم الطفل المتوحد باحترام","summary":"تهيئة البيئة والتواصل بناءً على احتياجات الطفل بدل محاولة محو اختلافه.","signals":["إرهاق حسي","صعوبة في الانتقال بين الأنشطة","تواصل بطرق غير لفظية"],"steps":["استخدم جداول بصرية","قلل المثيرات عند الإرهاق","احترم وسائل التواصل البديلة","ابنِ على الاهتمامات"],"phrases":["يمكنك أن تطلب استراحة","سنخبرك قبل التغيير"],"avoid":"إجبار الطفل على التواصل البصري أو منع سلوك تنظيمي آمن."},{"slug":"adhd-child","title":"دعم الطفل المصاب باضطراب فرط الحركة وتشتت الانتباه","summary":"تحويل التعليمات والبيئة إلى دعم عملي مع تقييم مهني شامل.","signals":["تشتت في أكثر من سياق","اندفاع يسبب مشكلات","صعوبة تنظيم الوقت والأغراض"],"steps":["قسّم التعليمات","استخدم تعزيزًا فوريًا محددًا","وفر حركة واستراحات","نسق بين البيت والمدرسة والمختص"],"phrases":["لاحظت أنك بدأت وحدك، هذا تقدم واضح","سنصمم البيئة لتساعد دماغك"],"avoid":"اختزال الطفل في التشخيص أو وصفه بالكسل."},{"slug":"learning-difficulties","title":"صعوبات التعلم وأثرها النفسي","summary":"حماية تقدير الذات بالتقييم والتكييف وعدم مساواة الذكاء بسرعة القراءة أو الحساب.","signals":["تفاوت بين الفهم الشفهي والأداء المكتوب","تجنب الواجب","شكوى من الغباء أو العجز"],"steps":["اطلب تقييمًا تربويًا متخصصًا","استخدم وسائل متعددة للتعلم","احتفل بالجهد والاستراتيجية","وفر تكييفات مناسبة"],"phrases":["الصعوبة في مهارة لا تحدد ذكاءك","سنجد طريقة تعلم تناسبك"],"avoid":"زيادة ساعات التدريب دون فهم نوع الصعوبة."},{"slug":"child-self-esteem","title":"تقدير الذات لدى الطفل","summary":"بناء إحساس بالقيمة قائم على العلاقة والجهد والكفاءة المتدرجة.","signals":["مقارنة نفسه دائمًا","الانسحاب خوفًا من الخطأ","طلب مدح مستمر"],"steps":["صف الجهد لا الشخصية فقط","اسمح بمسؤوليات مناسبة","تجنب المقارنات","ساعده على تحمل خطأ صغير"],"phrases":["أعجبني أنك واصلت المحاولة","قيمتك لا تتغير بنتيجة واحدة"],"avoid":"المدح المبالغ غير المحدد الذي لا يصدقه الطفل."},{"slug":"body-image-child","title":"صورة الجسد لدى الأطفال والمراهقين","summary":"تقليل التركيز على الشكل وتعزيز احترام الجسد ووظائفه وتنوعه.","signals":["تعليقات قاسية عن الوزن","تجنب الطعام أو الصور","مقارنة بالمؤثرين"],"steps":["أوقف تعليقات الوزن داخل البيت","تحدث عن قوة الجسد ووظيفته","راجع المحتوى الرقمي","اطلب دعمًا عند تغير الأكل أو الوزن"],"phrases":["الأجسام تتنوع ولا تحدد القيمة","نحن نهتم بصحتك لا بمقاسك"],"avoid":"اتباع حمية لطفل دون إشراف طبي."},{"slug":"teen-low-mood","title":"انخفاض المزاج والاكتئاب لدى المراهق","summary":"ملاحظة التغير المستمر في الأداء والاهتمامات لا انتظار التعبير المباشر عن الحزن.","signals":["فقدان الاهتمام","انسحاب أو تهيج مستمر","تغير النوم أو الدرجات"],"steps":["اسأل مباشرة بلطف","حافظ على اتصال يومي قصير","اطلب تقييمًا مهنيًا","اسأل عن إيذاء النفس عند القلق"],"phrases":["لاحظت أنك لم تعد تستمتع بما تحب","هل راودتك أفكار عن إيذاء نفسك؟"],"avoid":"اعتبار كل شيء تمردًا أو سحب الهاتف كحل وحيد."},{"slug":"self-harm-warning","title":"إيذاء النفس لدى اليافعين: علامات واستجابة","summary":"التعامل المباشر والهادئ مع الخطر ووضع خطة أمان ودعم مهني.","signals":["جروح أو حروق متكررة","ملابس تغطي الجسد باستمرار في الحر","أدوات أو رسائل مرتبطة بالأذى"],"steps":["اسأل بهدوء دون لوم","أبعد الوسائل الخطرة عند وجود خطر","لا تتركه وحده في أزمة حادة","تواصل مع طوارئ أو مختص"],"phrases":["أنا لست غاضبًا، أريد أن أحميك","هل لديك خطة أو وسيلة الآن؟"],"avoid":"العقاب أو التهديد أو نشر الأمر بين الأقارب."},{"slug":"when-child-needs-help","title":"متى يحتاج الطفل إلى مختص نفسي","summary":"تمييز الصعوبات المتوقعة عن نمط مستمر أو شديد أو خطِر.","signals":["أعراض تستمر أسابيع","تعطل الدراسة أو النوم أو العلاقات","خطر على النفس أو الآخرين"],"steps":["دوّن مدة وتكرار الأعراض","استبعد أسبابًا طبية","اسأل المدرسة","اختر مختصًا مؤهلًا للأطفال"],"phrases":["طلب المساعدة خطوة حماية","سنشرح لك ما سيحدث قبل الموعد"],"avoid":"انتظار أن يطلب الطفل العلاج بصيغة الكبار."}]}