{"key":"home","title":"الصحة النفسية للعائلة","subtitle":"تصميم الحياة اليومية والبيت والروتين والطقوس بما يدعم الراحة والانتماء والمرونة.","illustration":"home.svg","accent":"gold","sources":[{"name":"UNICEF Jordan Parenting Hub","url":"https://www.unicef.org/jordan/parenting-hub"},{"name":"UNICEF Parenting — Health","url":"https://www.unicef.org/parenting/health"}],"articles":[{"slug":"daily-family-rhythm","title":"إيقاع يومي يحمي الصحة النفسية للعائلة","summary":"تنظيم اليوم حول نقاط ثابتة مرنة تمنح الأطفال والكبار شعورًا بالتوقع والأمان.","signals":["فوضى صباحية متكررة","انتقال كل فرد بين مهام بلا تنسيق","خلافات مستمرة حول المواعيد"],"steps":["حددوا ثلاث نقاط ثابتة فقط","استخدموا لوحة أسبوعية","اتركوا وقتًا احتياطيًا","راجعوا الروتين كل شهر"],"phrases":["لدينا خطة تساعدنا وليست سجنًا","سنغيّر ما لا يعمل"],"avoid":"حشو اليوم بالأنشطة حتى يختفي وقت الراحة."},{"slug":"shared-meals","title":"الوجبات المشتركة والعلاقة الأسرية","summary":"استخدام بعض الوجبات كمساحة اتصال لا كمكان للتحقيق أو نقد الأجسام.","signals":["كل شخص يأكل وحده دائمًا","توتر حول الطعام","تحول المائدة إلى محاسبة"],"steps":["اختاروا عددًا واقعيًا من الوجبات المشتركة","أبعدوا الشاشات","اسألوا سؤالًا خفيفًا","تجنبوا تعليقات الوزن"],"phrases":["ما أجمل لحظة في يومك؟","لا توجد إجابة صحيحة على المائدة"],"avoid":"إجبار الطفل على كشف مشكلات حساسة أمام الجميع."},{"slug":"home-calm-corner","title":"زاوية هدوء منزلية","summary":"تهيئة مكان بسيط للتهدئة الحسية والانفعالية دون استخدامه كعقاب.","signals":["عدم وجود مكان للانسحاب الآمن","تفاقم الخلاف بسبب الضوضاء","لجوء الأطفال للاختباء"],"steps":["اختاروا مكانًا مرئيًا وآمنًا","ضعوا أدوات تهدئة بسيطة","اجعلوه متاحًا للجميع","علّموا العودة بعد الهدوء"],"phrases":["يمكنك أخذ استراحة ثم نعود","زاوية الهدوء ليست عقوبة"],"avoid":"إغلاق الطفل وحده أو منعه من العودة."},{"slug":"family-rituals","title":"الطقوس العائلية الصغيرة","summary":"بناء ذكريات وهوية مشتركة عبر ممارسات قصيرة قابلة للاستمرار.","signals":["العائلة تجتمع فقط عند المشكلات","شعور الأطفال بعدم الاستقرار","اختفاء الفرح من الروتين"],"steps":["اختاروا طقسًا أسبوعيًا واحدًا","اجعلوه منخفض التكلفة","اسمحوا بالتناوب في الاختيار","احموا الاستمرارية دون صرامة"],"phrases":["هذا وقتنا المشترك","لا نحتاج مناسبة كبيرة لنصنع ذكرى"],"avoid":"تحويل الطقس إلى واجب مثالي مرهق."},{"slug":"digital-home","title":"البيت الرقمي المتوازن","summary":"تصميم بيئة رقمية تحمي النوم والانتباه والعلاقات والخصوصية.","signals":["هواتف في غرف النوم","تنبيهات مستمرة","خلافات يومية على المحتوى"],"steps":["أنشئوا محطة شحن خارج الغرف","حددوا ساعات اتصال","راجعوا الخصوصية","اتفقوا على قدوة الكبار"],"phrases":["نحن ندير التقنية ولا تديرنا","الخصوصية حق مع مسؤولية"],"avoid":"مراقبة كل رسالة دون سبب أو حوار."},{"slug":"family-rest","title":"الراحة الجماعية في المنزل","summary":"إعادة الاعتبار للبطء والفراغ كجزء من الصحة النفسية.","signals":["شعور بالذنب عند عدم الإنتاج","أيام مزدحمة بلا توقف","تهيج مساءً"],"steps":["ضعوا فترة هدوء أسبوعية","احموا النوم","قللوا الالتزامات المتزامنة","اسمحوا بالملل الآمن للأطفال"],"phrases":["الراحة نشاط صحي","لسنا مطالبين بملء كل دقيقة"],"avoid":"استخدام الراحة ذريعة لعزل كل فرد تمامًا."},{"slug":"chores-fairness","title":"العدالة في الأعمال المنزلية","summary":"توزيع العمل المرئي وغير المرئي بطريقة تناسب العمر والقدرة.","signals":["شخص واحد يخطط ويتابع كل شيء","خلافات على المهام","شعور الأطفال أن المشاركة عقاب"],"steps":["اكتبوا قائمة كاملة","وزعوا الملكية لا التعليمات فقط","استخدموا تناوبًا","راجعوا التوازن"],"phrases":["هذه مسؤولية مشتركة","سنختار مهمة تناسب عمرك"],"avoid":"ربط القيمة الشخصية بنظافة مثالية."},{"slug":"family-emotional-language","title":"لغة المشاعر في البيت","summary":"توسيع مفردات الأسرة لتقليل الانفجار وسوء الفهم.","signals":["استخدام كلمة زعلان لكل شيء","صعوبة طلب الاحتياجات","سخرية من البكاء"],"steps":["استخدموا بطاقات مشاعر","اربطوا الشعور بالحاجة","شارك الكبار نموذجًا بسيطًا","ميزوا الشعور عن السلوك"],"phrases":["أنا متوتر وأحتاج وقتًا","الغضب رسالة وليس إذنًا للأذى"],"avoid":"تحليل مشاعر شخص رغم رفضه."},{"slug":"family-crisis-plan","title":"خطة منزلية للأزمات النفسية","summary":"الاستعداد المسبق للأزمات يقلل الارتباك ويحسن السلامة.","signals":["عدم معرفة أرقام الطوارئ","اختلاف الأسرة حول من يتصرف","وجود وسائل خطرة بلا خطة"],"steps":["اكتبوا أرقام الدعم","حددوا علامات الإنذار","اتفقوا على إزالة الوسائل الخطرة","حددوا شخصًا بديلًا للرعاية"],"phrases":["عندما يزداد الخطر سنتبع الخطة","طلب الطوارئ حماية لا فضيحة"],"avoid":"الاعتماد على الوعود وحدها عند خطر حاد."},{"slug":"family-conversations","title":"حوارات عائلية حساسة","summary":"إدارة موضوعات مثل الموت والجنس والمرض والمال بلغة مناسبة للعمر.","signals":["تجنب كامل للموضوع","تلقي الأطفال معلومات من مصادر غير موثوقة","أسئلة تظهر في أوقات التوتر"],"steps":["ابدؤوا بما يعرفه الطفل","قدموا إجابة قصيرة وصادقة","اسمحوا بالعودة للموضوع","اعترفوا عندما لا تعرفون"],"phrases":["ما الذي سمعته عن هذا؟","سأخبرك بما يناسب عمرك بصدق"],"avoid":"إغراق الطفل بتفاصيل الكبار."},{"slug":"blended-family","title":"العائلة المركبة بعد الزواج الجديد","summary":"بناء الثقة تدريجيًا مع احترام الروابط السابقة والأدوار الواقعية.","signals":["ضغط على الطفل لقبول قرب سريع","منافسة بين البيوت","غموض في السلطة"],"steps":["اتفقوا على قواعد أساسية مشتركة","اتركوا العلاقة تنمو دون فرض","احترموا الوالد الآخر","خصصوا وقتًا فرديًا"],"phrases":["لا تحتاج أن تختار بين من تحب","الثقة تنمو مع الوقت"],"avoid":"مطالبة الطفل باستخدام لقب لا يريده."},{"slug":"extended-family-boundaries","title":"الحدود مع العائلة الممتدة","summary":"حفظ الصلة مع حماية قرارات البيت والخصوصية.","signals":["تدخل متكرر في التربية","نقل الأسرار","ضغط اجتماعي على القرارات"],"steps":["حددوا ما يمكن مشاركته","اجعلوا الزوجين فريقًا","استخدموا ردًا ثابتًا","قللوا النقاش عند تجاوز الحدود"],"phrases":["نقدّر اهتمامكم والقرار لنا","لن نناقش تفاصيل خاصة"],"avoid":"قطع العلاقات فورًا دون محاولة حدود آمنة عند عدم وجود خطر."},{"slug":"home-after-conflict","title":"إعادة الهدوء للمنزل بعد شجار","summary":"مساعدة الجسم والعلاقة على الخروج من حالة الاستنفار.","signals":["صمت عدائي طويل","توتر الأطفال بعد شجار الكبار","عودة الخلاف من دون إصلاح"],"steps":["أوقفوا النقاش عند التصعيد","طمئنوا الأطفال دون تحميلهم التفاصيل","أصلحوا الضرر","غيّروا المحفز العملي"],"phrases":["الخلاف بين الكبار وليس مسؤوليتك","سنعود للحديث عندما نهدأ"],"avoid":"التظاهر بأن شيئًا لم يحدث."},{"slug":"care-for-elderly","title":"رعاية كبار السن والصحة النفسية للعائلة","summary":"موازنة الكرامة والاستقلال مع السلامة وتقليل استنزاف مقدمي الرعاية.","signals":["صراع على القرارات","إرهاق مقدم الرعاية","عزلة المسن"],"steps":["أشركوا المسن في القرار","وزعوا الرعاية","افحصوا الاكتئاب والخرف والأدوية","حافظوا على نشاط اجتماعي"],"phrases":["نريد دعم استقلالك لا سلبه","سنقسم الرعاية بيننا"],"avoid":"افتراض أن كل تغير نفسي طبيعي مع العمر."},{"slug":"family-movement","title":"الحركة المشتركة والمزاج","summary":"استخدام النشاط كفرصة اتصال وتنظيم لا كمشروع وزن.","signals":["خمول طويل","توتر بعد المدرسة أو العمل","قضاء العطلة أمام الشاشات"],"steps":["اختاروا نشاطًا ممتعًا","ابدؤوا بوقت قصير","نوّعوا بحسب القدرة","تجنبوا لغة الوزن"],"phrases":["نتحرك لنشعر أفضل","كل جسم يشارك بطريقته"],"avoid":"تحويل النشاط إلى عقاب على الطعام."},{"slug":"family-nature","title":"الطبيعة كمساحة تعافٍ عائلية","summary":"استثمار الضوء والهواء والمساحات الخضراء لتقليل الضغط وزيادة الحضور.","signals":["قضاء أسابيع داخل البيت","توتر رقمي","قلة الحديث الطبيعي"],"steps":["حددوا نزهة قصيرة","اتركوا الهواتف بعض الوقت","لاحظوا الحواس","اجعلوا النشاط بسيطًا"],"phrases":["نخرج لنغير إيقاع اليوم","لا نحتاج وجهة بعيدة"],"avoid":"تحويل الخروج إلى برنامج مرهق."},{"slug":"family-celebrations","title":"الاحتفال دون ضغط نفسي","summary":"صنع مناسبات دافئة تراعي الميزانية والاختلاف الحسي والعائلي.","signals":["توتر مالي قبل المناسبات","نزاعات على التوقعات","إجهاد حسي للأطفال"],"steps":["حددوا الأولويات","اتفقوا على ميزانية","وفروا مساحة هادئة","احترموا من لا يريد مشاركة كاملة"],"phrases":["المعنى أهم من الكمال","يمكنك أخذ استراحة"],"avoid":"قياس الحب بحجم الإنفاق."},{"slug":"home-study-space","title":"مساحة دراسة تدعم النفسية","summary":"تهيئة بيئة تعلم تقلل الاحتكاك وتراعي الاختلافات.","signals":["واجبات في وسط ضوضاء","صراع يومي على البدء","جلوس طويل بلا استراحة"],"steps":["حددوا مكانًا ثابتًا","قللوا المشتتات","قسّموا الوقت","اجعلوا الأدوات جاهزة"],"phrases":["نبدأ بعشر دقائق","المكان يساعدك لا يختبر إرادتك"],"avoid":"المراقبة اللصيقة طوال المهمة."},{"slug":"family-hospitality","title":"الضيافة والزيارات دون استنزاف","summary":"حماية طاقة الأسرة مع الحفاظ على العلاقات الاجتماعية.","signals":["إرهاق قبل وبعد كل زيارة","إجبار الأطفال على القرب الجسدي","تجاوز مواعيد النوم باستمرار"],"steps":["حددوا مدة الزيارة","احترموا رفض العناق","بسّطوا الضيافة","اتفقوا على إشارة انسحاب"],"phrases":["يسعدنا حضوركم حتى هذا الوقت","يمكن للطفل التحية بطريقته"],"avoid":"إجبار الأسرة على الأداء الاجتماعي رغم الإنهاك."},{"slug":"family-weekly-reset","title":"إعادة ضبط أسبوعية للعائلة","summary":"مراجعة قصيرة تجمع التنظيم والعاطفة قبل بدء أسبوع جديد.","signals":["بدء الأسبوع بفوضى","نسيان المواعيد","تراكم توتر غير مناقش"],"steps":["راجعوا التقويم","اختاروا وجبتين سهلتين","اسألوا عن أصعب شيء متوقع","حددوا دعمًا لكل فرد"],"phrases":["ما الشيء الذي يحتاج دعمًا هذا الأسبوع؟","نخطط بما يكفي ونترك مساحة للمفاجآت"],"avoid":"تحويل المراجعة إلى قائمة لوم."}]}